{"applicationVersion":"v0.1.0","artifactSetDigest":"sha256:feec32d661b828b5a3a8e271ff852926cb3f0096395af8f5ea30c4ebd0e143a8","artifacts":[{"path":"artifacts/backend-fixture.txt","sha256":"sha256:094c89e3bb8ff11d31388e75dcbd72e05cb96b089cbba957a9213934440e48a6","size":25}],"baseImages":[{"reference":"docker.io/library/golang:1.26.5-bookworm@sha256:1ecb7edf62a0408027bd5729dfd6b1b8766e578e8df93995b225dfd0944eb651"},{"reference":"gcr.io/distroless/static-debian13:nonroot@sha256:f7f8f729987ad0fdf6b05eeeae94b26e6a0f613bdf46feea7fc40f7bd72953e6"}],"checksumInventory":{"path":"SHA256SUMS","sha256":"sha256:1474628ba9951fb00b06846eb04ca4d1ec6272ad1ea383dfd28580c76951a540","size":96},"compatibility":{"archive":{"castRulesVersion":"cast-exact-v1","compatibilityMatrixDigest":"sha256:7677bf83d62f38e9ac9d7af5eab2e37342a110533b63ce6f6a940d8607b84bd9","domainRulesVersion":"domain-raw-v1","manifestSchemaDigest":"sha256:5a2b0cd7294312e9dcbdd413a1b01c4218652c4c39fd7472b74e40622e7a3e73","manifestSchemaVersion":{"maximum":1,"minimum":1},"schemaSqlDigest":"sha256:04fde49cb4ab9984ed20c675db850484dd2f4ec084e9ab4c219754e7033a3255","sqliteSchemaVersion":{"maximum":2,"minimum":2}},"openapiDigest":"sha256:7c824311d70f157498b0907816be3d60ee9483e7d0e867d91f9c3425e19fef56"},"component":"backend","inputs":[{"path":"backend/go.mod","sha256":"sha256:aaaaaaaaaaaaaaaaaaaaaaaaaaaaaaaaaaaaaaaaaaaaaaaaaaaaaaaaaaaaaaaa"},{"path":"backend/internal/archivebuild/assets/display-v1.yaml","sha256":"sha256:7368a53fc834bbcafef5b57f9cd38423b7ff83729726ae3c62370988821b90ab"},{"path":"backend/internal/archivebuild/assets/schema.sql","sha256":"sha256:04fde49cb4ab9984ed20c675db850484dd2f4ec084e9ab4c219754e7033a3255"},{"path":"backend/internal/archivebuild/assets/staff-sets-v1.yaml","sha256":"sha256:df2ad5c80add8898ebf61a0eced86f608374e528b34b881c3fe741b177be8dae"},{"path":"contracts/producer-runtime-inputs-v1","sha256":"sha256:c386eeb13c6267177534a5ce07346840c68e952e75d5913fb249b93161511b85"},{"path":"toolchain/buildkit-image","sha256":"sha256:1e110c71d389d6d24f67b9438e2f7b8da749a6ff407b22a1631e025c95599368"}],"sbom":{"documentNamespace":"https://spdx.bangumi-staff-stats.invalid/backend/sha256-094c89e3bb8ff11d31388e75dcbd72e05cb96b089cbba957a9213934440e48a6","packageCount":2,"path":"backend.spdx.json","sha256":"sha256:5ad1533a8e7cffed06971e3e3b60eb22fce0140dfb54db1fa2bfd562af13eeec","size":1295},"schemaVersion":1,"source":{"revision":"665c300f10c2ba572caede29951e63ea2349da7c","tree":"c391c210dc73c20c5d957416c15e73e1d70c81a8"},"target":{"architecture":"arm64","os":"linux"},"toolchain":[{"name":"buildkit","version":"0.27.1"},{"name":"docker-buildx","version":"0.34.1"},{"name":"go","version":"1.26.5"}]}
