{"applicationVersion":"v0.1.0","artifactSetDigest":"sha256:9e5b5438e40ff7e00d72849a6b6c04adfce6ae2fa8d69c18ffc15d44d1943816","artifacts":[{"path":"artifacts/frontend-fixture.txt","sha256":"sha256:fd66b37177fb676be8b7488cd9844a6d79c9573b61d0b00c29bf7dee316f36d2","size":26}],"baseImages":[],"checksumInventory":{"path":"SHA256SUMS","sha256":"sha256:cf550716d118b39c994cd5dabadd56450bec553a116a3cfef540d4c498e1a19e","size":97},"compatibility":{"archive":{"castRulesVersion":"cast-exact-v1","compatibilityMatrixDigest":"sha256:7677bf83d62f38e9ac9d7af5eab2e37342a110533b63ce6f6a940d8607b84bd9","domainRulesVersion":"domain-raw-v1","manifestSchemaDigest":"sha256:5a2b0cd7294312e9dcbdd413a1b01c4218652c4c39fd7472b74e40622e7a3e73","manifestSchemaVersion":{"maximum":1,"minimum":1},"schemaSqlDigest":"sha256:04fde49cb4ab9984ed20c675db850484dd2f4ec084e9ab4c219754e7033a3255","sqliteSchemaVersion":{"maximum":2,"minimum":2}},"openapiDigest":"sha256:7c824311d70f157498b0907816be3d60ee9483e7d0e867d91f9c3425e19fef56"},"component":"frontend","inputs":[{"path":"frontend/package-lock.json","sha256":"sha256:bbbbbbbbbbbbbbbbbbbbbbbbbbbbbbbbbbbbbbbbbbbbbbbbbbbbbbbbbbbbbbbb"}],"sbom":{"documentNamespace":"https://spdx.bangumi-staff-stats.invalid/frontend/sha256-fd66b37177fb676be8b7488cd9844a6d79c9573b61d0b00c29bf7dee316f36d2","packageCount":2,"path":"frontend.spdx.json","sha256":"sha256:5a64d336b6c765539cce3a2332c6cf46d53b176f441bfc423edfa712c812af78","size":1259},"schemaVersion":1,"source":{"revision":"665c300f10c2ba572caede29951e63ea2349da7c","tree":"c391c210dc73c20c5d957416c15e73e1d70c81a8"},"target":{"architecture":"arm64","os":"linux"},"toolchain":[{"name":"node","version":"24.18.0"},{"name":"npm","version":"11.16.0"},{"name":"vite","version":"8.1.5"}]}
